report_school_year,aggregation_type,School,lea_beds,District,nrc_code,District_Desc,county_code,county_name,nyc_ind,boces_code,boces_name,subgroup_name,enrollment_count,graduation_count,graduation_percentage,regents_diploma_count,regents_diploma_percentage,advanced_regents_diploma_count,advanced_regents_diploma_percentage,ged_count,ged_percentage,dropout_count,dropout_percentage
2018-19,School,ALBANY HIGH SCHOOL,10100010000,ALBANY CITY SCHOOL DISTRICT,3,Urban-Suburban High Needs,1,ALBANY,0,190,ALBANY-SCHENECTADY-SCHOHARIE(CAPITAL REGION),All Students,688,470,0.68,313,0.45,113,0.16,7,0.01,114,0.17
2018-19,School,GREEN TECH HIGH CHARTER SCHOOL,10100860907,GREEN TECH HIGH CHARTER SCHOOL,7,Charters,1,ALBANY,0,190,ALBANY-SCHENECTADY-SCHOHARIE(CAPITAL REGION),All Students,60,54,0.9,43,0.72,9,0.15,0,0,0,0
2018-19,School,ALBANY LEADERSHIP CHARTER HIGH SCHOOL FOR GIRLS,10100860960,ALBANY LEADERSHIP CHARTER HIGH SCHOOL FOR GIRLS,7,Charters,1,ALBANY,0,190,ALBANY-SCHENECTADY-SCHOHARIE(CAPITAL REGION),All Students,93,81,0.87,61,0.66,14,0.15,1,0.01,10,0.11
2018-19,School,BERNE-KNOX-WESTERLO JUNIOR-SENIOR HIGH SCHOOL,10201040000,BERNE-KNOX-WESTERLO CENTRAL SCHOOL DISTRICT,5,Average Needs,1,ALBANY,0,190,ALBANY-SCHENECTADY-SCHOHARIE(CAPITAL REGION),All Students,56,51,0.91,29,0.52,18,0.32,0,0,3,0.05
2018-19,School,BETHLEHEM CENTRAL SENIOR HIGH SCHOOL,10306060000,BETHLEHEM CENTRAL SCHOOL DISTRICT,6,Low Needs,1,ALBANY,0,190,ALBANY-SCHENECTADY-SCHOHARIE(CAPITAL REGION),All Students,398,385,0.97,111,0.28,268,0.67,0,0,7,0.02
2018-19,School,RAVENA SENIOR HIGH SCHOOL,10402060000,RAVENA-COEYMANS-SELKIRK CENTRAL SCHOOL DISTRICT,5,Average Needs,1,ALBANY,0,190,ALBANY-SCHENECTADY-SCHOHARIE(CAPITAL REGION),All Students,147,134,0.91,59,0.4,63,0.43,0,0,9,0.06
2018-19,School,COHOES HIGH SCHOOL,10500010000,COHOES CITY SCHOOL DISTRICT,3,Urban-Suburban High Needs,1,ALBANY,0,190,ALBANY-SCHENECTADY-SCHOHARIE(CAPITAL REGION),All Students,133,112,0.84,65,0.49,28,0.21,0,0,13,0.1
2018-19,School,COLONIE CENTRAL HIGH SCHOOL,10601060000,SOUTH COLONIE CENTRAL SCHOOL DISTRICT,5,Average Needs,1,ALBANY,0,190,ALBANY-SCHENECTADY-SCHOHARIE(CAPITAL REGION),All Students,368,340,0.92,118,0.32,205,0.56,0,0,5,0.01
2018-19,School,SHAKER HIGH SCHOOL,10623060000,NORTH COLONIE CSD,6,Low Needs,1,ALBANY,0,190,ALBANY-SCHENECTADY-SCHOHARIE(CAPITAL REGION),All Students,505,472,0.93,146,0.29,321,0.64,0,0,11,0.02
2018-19,School,HEATLY SCHOOL,10701030000,GREEN ISLAND UNION FREE SCHOOL DISTRICT,3,Urban-Suburban High Needs,1,ALBANY,0,190,ALBANY-SCHENECTADY-SCHOHARIE(CAPITAL REGION),All Students,19,15,0.79,9,0.47,3,0.16,0,0,2,0.11
2018-19,School,GUILDERLAND HIGH SCHOOL,10802060000,GUILDERLAND CENTRAL SCHOOL DISTRICT,6,Low Needs,1,ALBANY,0,190,ALBANY-SCHENECTADY-SCHOHARIE(CAPITAL REGION),All Students,345,329,0.95,90,0.26,227,0.66,0,0,5,0.01
2018-19,School,C A BOUTON MIDDLE SCHOOL HIGH SCHOOL,11003060000,VOORHEESVILLE CENTRAL SCHOOL DISTRICT,6,Low Needs,1,ALBANY,0,190,ALBANY-SCHENECTADY-SCHOHARIE(CAPITAL REGION),All Students,95,94,0.99,32,0.34,59,0.62,0,0,1,0.01
2018-19,School,WATERVLIET JUNIOR-SENIOR HIGH SCHOOL,11200010000,WATERVLIET CITY SCHOOL DISTRICT,3,Urban-Suburban High Needs,1,ALBANY,0,190,ALBANY-SCHENECTADY-SCHOHARIE(CAPITAL REGION),All Students,102,80,0.78,53,0.52,23,0.23,0,0,18,0.18
2018-19,School,ALFRED-ALMOND JUNIOR-SENIOR HIGH SCHOOL,20101040000,ALFRED-ALMOND CENTRAL SCHOOL DISTRICT,5,Average Needs,2,ALLEGANY,0,5590,SCHUYLER-STEUBEN-CHEMUNG-TIOGA-ALLEGANY,All Students,48,44,0.92,16,0.33,26,0.54,0,0,1,0.02
2018-19,School,ANDOVER SCHOOL,20601040000,ANDOVER CENTRAL SCHOOL DISTRICT,4,Rural High Needs,2,ALLEGANY,0,490,CATTARAUGUS-ALLEGANY-ERIE-WYOMING,All Students,20,19,0.95,12,0.6,6,0.3,0,0,1,0.05
2018-19,School,GENESEE VALLEY ELEMENTARY SCHOOL,20702040000,GENESEE VALLEY CENTRAL SCHOOL DISTRICT,4,Rural High Needs,2,ALLEGANY,0,490,CATTARAUGUS-ALLEGANY-ERIE-WYOMING,All Students,38,34,0.89,16,0.42,18,0.47,0,0,4,0.11
2018-19,School,BELFAST SCHOOL,20801040000,BELFAST CENTRAL SCHOOL DISTRICT,4,Rural High Needs,2,ALLEGANY,0,490,CATTARAUGUS-ALLEGANY-ERIE-WYOMING,All Students,17,16,0.94,8,0.47,7,0.41,0,0,1,0.06
2018-19,School,CANASERAGA SCHOOL,21102040000,CANASERAGA CENTRAL SCHOOL DISTRICT,4,Rural High Needs,2,ALLEGANY,0,5590,SCHUYLER-STEUBEN-CHEMUNG-TIOGA-ALLEGANY,All Students,17,11,0.65,8,0.47,3,0.18,0,0,4,0.24
2018-19,School,FRIENDSHIP CENTRAL SCHOOL,21601040000,FRIENDSHIP CENTRAL SCHOOL DISTRICT,4,Rural High Needs,2,ALLEGANY,0,490,CATTARAUGUS-ALLEGANY-ERIE-WYOMING,All Students,19,19,1,11,0.58,5,0.26,0,0,0,0
2018-19,School,FILLMORE CENTRAL SCHOOL,22001040000,FILLMORE CENTRAL SCHOOL DISTRICT,4,Rural High Needs,2,ALLEGANY,0,490,CATTARAUGUS-ALLEGANY-ERIE-WYOMING,All Students,47,47,1,26,0.55,17,0.36,0,0,0,0
2018-19,School,WHITESVILLE CENTRAL SCHOOL,22101040000,WHITESVILLE CENTRAL SCHOOL DISTRICT,4,Rural High Needs,2,ALLEGANY,0,490,CATTARAUGUS-ALLEGANY-ERIE-WYOMING,All Students,17,15,0.88,8,0.47,6,0.35,0,0,1,0.06
2018-19,School,CUBA-RUSHFORD HIGH SCHOOL,22302040000,CUBA-RUSHFORD CENTRAL SCHOOL DISTRICT,4,Rural High Needs,2,ALLEGANY,0,490,CATTARAUGUS-ALLEGANY-ERIE-WYOMING,All Students,69,64,0.93,30,0.43,28,0.41,0,0,2,0.03
2018-19,School,SCIO CENTRAL SCHOOL,22401040000,SCIO CENTRAL SCHOOL DISTRICT,4,Rural High Needs,2,ALLEGANY,0,490,CATTARAUGUS-ALLEGANY-ERIE-WYOMING,All Students,25,23,0.92,18,0.72,5,0.2,0,0,1,0.04
2018-19,School,WELLSVILLE SENIOR HIGH SCHOOL,22601060000,WELLSVILLE CENTRAL SCHOOL DISTRICT,4,Rural High Needs,2,ALLEGANY,0,490,CATTARAUGUS-ALLEGANY-ERIE-WYOMING,All Students,116,105,0.91,69,0.59,32,0.28,0,0,6,0.05
2018-19,School,BOLIVAR-RICHBURG JUNIOR-SENIOR HIGH SCHOOL,22902040000,BOLIVAR-RICHBURG CENTRAL SCHOOL DISTRICT,4,Rural High Needs,2,ALLEGANY,0,490,CATTARAUGUS-ALLEGANY-ERIE-WYOMING,All Students,43,40,0.93,24,0.56,11,0.26,1,0.02,1,0.02
2018-19,School,CHENANGO FORKS HIGH SCHOOL,30101060000,CHENANGO FORKS CENTRAL SCHOOL DISTRICT,5,Average Needs,3,BROOME,0,390,BROOME-DELAWARE-TIOGA,All Students,126,121,0.96,73,0.58,42,0.33,0,0,2,0.02
2018-19,School,BINGHAMTON HIGH SCHOOL,30200010000,BINGHAMTON CITY SCHOOL DISTRICT,3,Urban-Suburban High Needs,3,BROOME,0,390,BROOME-DELAWARE-TIOGA,All Students,382,282,0.74,190,0.5,54,0.14,7,0.02,60,0.16
2018-19,School,HARPURSVILLE JUNIOR-SENIOR HIGH SCHOOL,30501040000,HARPURSVILLE CENTRAL SCHOOL DISTRICT,4,Rural High Needs,3,BROOME,0,390,BROOME-DELAWARE-TIOGA,All Students,73,64,0.88,35,0.48,18,0.25,0,0,5,0.07
2018-19,School,SUSQUEHANNA VALLEY SENIOR HIGH SCHOOL,30601060000,SUSQUEHANNA VALLEY CENTRAL SCHOOL DISTRICT,5,Average Needs,3,BROOME,0,390,BROOME-DELAWARE-TIOGA,All Students,114,105,0.92,51,0.45,49,0.43,2,0.02,5,0.04
2018-19,School,CHENANGO VALLEY HIGH SCHOOL,30701060000,CHENANGO VALLEY CENTRAL SCHOOL DISTRICT,4,Rural High Needs,3,BROOME,0,390,BROOME-DELAWARE-TIOGA,All Students,135,125,0.93,63,0.47,53,0.39,4,0.03,3,0.02
2018-19,School,MAINE-ENDWELL SENIOR HIGH SCHOOL,31101060000,MAINE-ENDWELL CENTRAL SCHOOL DISTRICT,5,Average Needs,3,BROOME,0,390,BROOME-DELAWARE-TIOGA,All Students,174,167,0.96,62,0.36,95,0.55,0,0,4,0.02
2018-19,School,DEPOSIT MIDDLE-SENIOR HIGH SCHOOL,31301040000,DEPOSIT CENTRAL SCHOOL DISTRICT,4,Rural High Needs,3,BROOME,0,390,BROOME-DELAWARE-TIOGA,All Students,39,38,0.97,18,0.46,16,0.41,0,0,1,0.03
2018-19,School,WHITNEY POINT SENIOR HIGH SCHOOL,31401060000,WHITNEY POINT CENTRAL SCHOOL DISTRICT,4,Rural High Needs,3,BROOME,0,390,BROOME-DELAWARE-TIOGA,All Students,114,99,0.87,54,0.47,42,0.37,0,0,8,0.07
2018-19,School,LINNAEUS W WEST SCHOOL,31501060000,UNION-ENDICOTT CENTRAL SCHOOL DISTRICT,5,Average Needs,3,BROOME,0,390,BROOME-DELAWARE-TIOGA,All Students,-,-,-,-,-,-,-,-,-,-,-
2018-19,School,UNION ENDICOTT HIGH SCHOOL,31501060000,UNION-ENDICOTT CENTRAL SCHOOL DISTRICT,5,Average Needs,3,BROOME,0,390,BROOME-DELAWARE-TIOGA,All Students,292,268,0.92,108,0.37,129,0.44,3,0.01,14,0.05
2018-19,School,JOHNSON CITY SENIOR HIGH SCHOOL,31502060000,JOHNSON CITY CENTRAL SCHOOL DISTRICT,3,Urban-Suburban High Needs,3,BROOME,0,390,BROOME-DELAWARE-TIOGA,All Students,177,160,0.9,80,0.45,69,0.39,1,0.01,9,0.05
2018-19,School,VESTAL SENIOR HIGH SCHOOL,31601060000,VESTAL CENTRAL SCHOOL DISTRICT,5,Average Needs,3,BROOME,0,390,BROOME-DELAWARE-TIOGA,All Students,274,265,0.97,63,0.23,194,0.71,1,0,4,0.01
2018-19,School,WINDSOR CENTRAL HIGH SCHOOL,31701060000,WINDSOR CENTRAL SCHOOL DISTRICT,5,Average Needs,3,BROOME,0,390,BROOME-DELAWARE-TIOGA,All Students,149,144,0.97,52,0.35,87,0.58,0,0,3,0.02
2018-19,School,WEST VALLEY CENTRAL SCHOOL,40204040000,WEST VALLEY CENTRAL SCHOOL DISTRICT,5,Average Needs,4,CATTARAUGUS,0,490,CATTARAUGUS-ALLEGANY-ERIE-WYOMING,All Students,26,23,0.88,15,0.58,8,0.31,0,0,3,0.12
2018-19,School,ALLEGANY-LIMESTONE HIGH SCHOOL,40302060000,ALLEGANY-LIMESTONE CENTRAL SCHOOL DISTRICT,5,Average Needs,4,CATTARAUGUS,0,490,CATTARAUGUS-ALLEGANY-ERIE-WYOMING,All Students,84,79,0.94,42,0.5,33,0.39,1,0.01,2,0.02
2018-19,School,ELLICOTTVILLE MIDDLE SCHOOL HIGH SCHOOL,40901040000,ELLICOTTVILLE CENTRAL SCHOOL DISTRICT,5,Average Needs,4,CATTARAUGUS,0,490,CATTARAUGUS-ALLEGANY-ERIE-WYOMING,All Students,37,36,0.97,17,0.46,17,0.46,0,0,1,0.03
2018-19,School,FRANKLINVILLE JUNIOR-SENIOR HIGH SCHOOL,41101040000,FRANKLINVILLE CENTRAL SCHOOL DISTRICT,4,Rural High Needs,4,CATTARAUGUS,0,490,CATTARAUGUS-ALLEGANY-ERIE-WYOMING,All Students,42,40,0.95,18,0.43,20,0.48,0,0,1,0.02
2018-19,School,HINSDALE CENTRAL SCHOOL,41401040000,HINSDALE CENTRAL SCHOOL DISTRICT,4,Rural High Needs,4,CATTARAUGUS,0,490,CATTARAUGUS-ALLEGANY-ERIE-WYOMING,All Students,20,20,1,17,0.85,2,0.1,0,0,0,0
2018-19,School,CATTARAUGUS-LITTLE VALLEY HIGH SCHOOL,42302040000,CATTARAUGUS-LITTLE VALLEY CENTRAL SCHOOL DISTRICT,5,Average Needs,4,CATTARAUGUS,0,490,CATTARAUGUS-ALLEGANY-ERIE-WYOMING,All Students,64,61,0.95,46,0.72,12,0.19,0,0,0,0
2018-19,School,OLEAN SENIOR HIGH SCHOOL,42400010000,OLEAN CITY SCHOOL DISTRICT,3,Urban-Suburban High Needs,4,CATTARAUGUS,0,490,CATTARAUGUS-ALLEGANY-ERIE-WYOMING,All Students,151,133,0.88,64,0.42,56,0.37,0,0,8,0.05
2018-19,School,GOWANDA  HIGH SCHOOL,42801060000,GOWANDA CENTRAL SCHOOL DISTRICT,4,Rural High Needs,4,CATTARAUGUS,0,1492,ERIE 2-CATTARAUGUS-CHAUTAUQUA,All Students,104,88,0.85,46,0.44,37,0.36,0,0,9,0.09
2018-19,School,PORTVILLE JUNIOR-SENIOR HIGH SCHOOL,42901040000,PORTVILLE CENTRAL SCHOOL DISTRICT,5,Average Needs,4,CATTARAUGUS,0,490,CATTARAUGUS-ALLEGANY-ERIE-WYOMING,All Students,78,71,0.91,46,0.59,21,0.27,0,0,4,0.05
2018-19,School,RANDOLPH SENIOR HIGH SCHOOL,43001040000,RANDOLPH CENTRAL SCHOOL DISTRICT,4,Rural High Needs,4,CATTARAUGUS,0,490,CATTARAUGUS-ALLEGANY-ERIE-WYOMING,All Students,67,62,0.93,38,0.57,18,0.27,0,0,4,0.06
2018-19,School,RANDOLPH ACADEMY,43011020000,RANDOLPH ACADEMY UNION FREE SCHOOL DISTRICT,5,Average Needs,4,CATTARAUGUS,0,490,CATTARAUGUS-ALLEGANY-ERIE-WYOMING,All Students,-,-,-,-,-,-,-,-,-,-,-
2018-19,School,SALAMANCA JUNIOR/SENIOR HIGH SCHOOL,43200050000,SALAMANCA CITY SCHOOL DISTRICT,4,Rural High Needs,4,CATTARAUGUS,0,490,CATTARAUGUS-ALLEGANY-ERIE-WYOMING,All Students,89,76,0.85,51,0.57,11,0.12,5,0.06,5,0.06
2018-19,School,PIONEER SENIOR HIGH SCHOOL,43501060000,YORKSHIRE-PIONEER CENTRAL SCHOOL DISTRICT,4,Rural High Needs,4,CATTARAUGUS,0,490,CATTARAUGUS-ALLEGANY-ERIE-WYOMING,All Students,188,172,0.91,108,0.57,58,0.31,1,0.01,8,0.04
2018-19,School,AUBURN HIGH SCHOOL,50100010000,AUBURN CITY SCHOOL DISTRICT,3,Urban-Suburban High Needs,5,CAYUGA,0,590,CAYUGA-ONONDAGA,All Students,312,228,0.73,106,0.34,109,0.35,13,0.04,53,0.17
2018-19,School,WEEDSPORT JUNIOR-SENIOR HIGH SCHOOL,50301040000,WEEDSPORT CENTRAL SCHOOL DISTRICT,5,Average Needs,5,CAYUGA,0,590,CAYUGA-ONONDAGA,All Students,60,56,0.93,24,0.4,29,0.48,0,0,2,0.03
2018-19,School,CATO-MERIDIAN SENIOR HIGH SCHOOL,50401040000,CATO-MERIDIAN CENTRAL SCHOOL DISTRICT,5,Average Needs,5,CAYUGA,0,590,CAYUGA-ONONDAGA,All Students,63,60,0.95,27,0.43,28,0.44,1,0.02,1,0.02
2018-19,School,SOUTHERN CAYUGA  7-12 SECONDARY SCHOOL,50701040000,SOUTHERN CAYUGA CENTRAL SCHOOL DISTRICT,5,Average Needs,5,CAYUGA,0,590,CAYUGA-ONONDAGA,All Students,36,34,0.94,14,0.39,18,0.5,1,0.03,1,0.03
2018-19,School,PORT BYRON SENIOR HIGH SCHOOL,51101040000,PORT BYRON CENTRAL SCHOOL DISTRICT,5,Average Needs,5,CAYUGA,0,590,CAYUGA-ONONDAGA,All Students,86,79,0.92,39,0.45,28,0.33,1,0.01,5,0.06
2018-19,School,MORAVIA JUNIOR-SENIOR HIGH SCHOOL,51301040000,MORAVIA CENTRAL SCHOOL DISTRICT,5,Average Needs,5,CAYUGA,0,590,CAYUGA-ONONDAGA,All Students,72,67,0.93,28,0.39,35,0.49,1,0.01,2,0.03
2018-19,School,UNION SPRINGS MIDDLE SCHOOL HIGH SCHOOL,51901040000,UNION SPRINGS CENTRAL SCHOOL DISTRICT,5,Average Needs,5,CAYUGA,0,590,CAYUGA-ONONDAGA,All Students,68,59,0.87,34,0.5,21,0.31,1,0.01,5,0.07
2018-19,School,SOUTHWESTERN SENIOR HIGH SCHOOL,60201060000,SOUTHWESTERN CENTRAL SCHOOL DISTRICT AT JAMESTOWN,5,Average Needs,6,CHAUTAUQUA,0,1492,ERIE 2-CATTARAUGUS-CHAUTAUQUA,All Students,103,100,0.97,44,0.43,48,0.47,0,0,1,0.01
2018-19,School,FREWSBURG JUNIOR-SENIOR HIGH SCHOOL,60301040000,FREWSBURG CENTRAL SCHOOL DISTRICT,5,Average Needs,6,CHAUTAUQUA,0,1492,ERIE 2-CATTARAUGUS-CHAUTAUQUA,All Students,62,59,0.95,31,0.5,24,0.39,0,0,2,0.03
2018-19,School,CASSADAGA VALLEY HIGH SCHOOL,60401040000,CASSADAGA VALLEY CENTRAL SCHOOL DISTRICT,4,Rural High Needs,6,CHAUTAUQUA,0,1492,ERIE 2-CATTARAUGUS-CHAUTAUQUA,All Students,57,54,0.95,23,0.4,24,0.42,0,0,1,0.02
2018-19,School,CHAUTAUQUA LAKE HIGH SCHOOL,60503040000,CHAUTAUQUA LAKE CENTRAL SCHOOL DISTRICT,5,Average Needs,6,CHAUTAUQUA,0,1492,ERIE 2-CATTARAUGUS-CHAUTAUQUA,All Students,59,55,0.93,34,0.58,16,0.27,0,0,1,0.02
2018-19,School,PINE VALLEY CENTRAL JUNIOR-SENIOR HIGH SCHOOL,60601040000,PINE VALLEY CENTRAL SCHOOL DISTRICT (SOUTH DAYTON),4,Rural High Needs,6,CHAUTAUQUA,0,1492,ERIE 2-CATTARAUGUS-CHAUTAUQUA,All Students,33,25,0.76,15,0.45,8,0.24,2,0.06,6,0.18
2018-19,School,CLYMER CENTRAL SCHOOL,60701040000,CLYMER CENTRAL SCHOOL DISTRICT,5,Average Needs,6,CHAUTAUQUA,0,1492,ERIE 2-CATTARAUGUS-CHAUTAUQUA,All Students,37,37,1,16,0.43,16,0.43,0,0,0,0
2018-19,School,DUNKIRK SENIOR HIGH SCHOOL,60800010000,DUNKIRK CITY SCHOOL DISTRICT,3,Urban-Suburban High Needs,6,CHAUTAUQUA,0,1492,ERIE 2-CATTARAUGUS-CHAUTAUQUA,All Students,168,123,0.73,83,0.49,35,0.21,0,0,31,0.18
2018-19,School,MAPLE GROVE HIGH SCHOOL,61001040000,BEMUS POINT CENTRAL SCHOOL DISTRICT,5,Average Needs,6,CHAUTAUQUA,0,1492,ERIE 2-CATTARAUGUS-CHAUTAUQUA,All Students,59,59,1,18,0.31,41,0.69,0,0,0,0
2018-19,School,FALCONER HIGH SCHOOL,61101040000,FALCONER CENTRAL SCHOOL DISTRICT,5,Average Needs,6,CHAUTAUQUA,0,1492,ERIE 2-CATTARAUGUS-CHAUTAUQUA,All Students,98,92,0.94,50,0.51,35,0.36,0,0,5,0.05
2018-19,School,SILVER CREEK HIGH SCHOOL,61501040000,SILVER CREEK CENTRAL SCHOOL DISTRICT,4,Rural High Needs,6,CHAUTAUQUA,0,1492,ERIE 2-CATTARAUGUS-CHAUTAUQUA,All Students,75,67,0.89,30,0.4,35,0.47,1,0.01,2,0.03
2018-19,School,FORESTVILLE CENTRAL HIGH SCHOOL,61503040000,FORESTVILLE CENTRAL SCHOOL DISTRICT,5,Average Needs,6,CHAUTAUQUA,0,1492,ERIE 2-CATTARAUGUS-CHAUTAUQUA,All Students,30,26,0.87,13,0.43,10,0.33,2,0.07,2,0.07
2018-19,School,PANAMA HIGH SCHOOL,61601040000,PANAMA CENTRAL SCHOOL DISTRICT,5,Average Needs,6,CHAUTAUQUA,0,1492,ERIE 2-CATTARAUGUS-CHAUTAUQUA,All Students,47,47,1,33,0.7,14,0.3,0,0,0,0
2018-19,School,JAMESTOWN HIGH SCHOOL,61700010000,JAMESTOWN CITY SCHOOL DISTRICT,3,Urban-Suburban High Needs,6,CHAUTAUQUA,0,1492,ERIE 2-CATTARAUGUS-CHAUTAUQUA,All Students,351,260,0.74,136,0.39,102,0.29,0,0,50,0.14
2018-19,School,FREDONIA HIGH SCHOOL,62201060000,FREDONIA CENTRAL SCHOOL DISTRICT,5,Average Needs,6,CHAUTAUQUA,0,1492,ERIE 2-CATTARAUGUS-CHAUTAUQUA,All Students,133,122,0.92,56,0.42,60,0.45,1,0.01,6,0.05
2018-19,School,BROCTON MIDDLE HIGH SCHOOL,62301040000,BROCTON CENTRAL SCHOOL DISTRICT,4,Rural High Needs,6,CHAUTAUQUA,0,1492,ERIE 2-CATTARAUGUS-CHAUTAUQUA,All Students,35,32,0.91,16,0.46,8,0.23,0,0,2,0.06
2018-19,School,SHERMAN CENTRAL SCHOOL,62601040000,SHERMAN CENTRAL SCHOOL DISTRICT,4,Rural High Needs,6,CHAUTAUQUA,0,1492,ERIE 2-CATTARAUGUS-CHAUTAUQUA,All Students,46,43,0.93,22,0.48,20,0.43,0,0,1,0.02
2018-19,School,WESTFIELD HIGH SCHOOL,62901040000,WESTFIELD CENTRAL SCHOOL DISTRICT,4,Rural High Needs,6,CHAUTAUQUA,0,1492,ERIE 2-CATTARAUGUS-CHAUTAUQUA,All Students,58,53,0.91,25,0.43,27,0.47,1,0.02,0,0
2018-19,School,SOUTHSIDE HIGH SCHOOL,70600010000,ELMIRA CITY SCHOOL DISTRICT,3,Urban-Suburban High Needs,7,CHEMUNG,0,5590,SCHUYLER-STEUBEN-CHEMUNG-TIOGA-ALLEGANY,All Students,465,293,0.63,156,0.34,105,0.23,34,0.07,88,0.19
2018-19,School,ELMIRA FREE ACADEMY,70600010000,ELMIRA CITY SCHOOL DISTRICT,3,Urban-Suburban High Needs,7,CHEMUNG,0,5590,SCHUYLER-STEUBEN-CHEMUNG-TIOGA-ALLEGANY,All Students,-,-,-,-,-,-,-,-,-,-,-
2018-19,School,HORSEHEADS SENIOR HIGH SCHOOL,70901060000,HORSEHEADS CENTRAL SCHOOL DISTRICT,5,Average Needs,7,CHEMUNG,0,5590,SCHUYLER-STEUBEN-CHEMUNG-TIOGA-ALLEGANY,All Students,347,321,0.93,111,0.32,199,0.57,0,0,14,0.04
2018-19,School,THOMAS A. EDISON HIGH SCHOOL,70902060000,ELMIRA HEIGHTS CENTRAL SCHOOL DISTRICT,5,Average Needs,7,CHEMUNG,0,5590,SCHUYLER-STEUBEN-CHEMUNG-TIOGA-ALLEGANY,All Students,77,63,0.82,38,0.49,21,0.27,0,0,10,0.13
2018-19,School,AFTON MIDDLE SCHOOL HIGH SCHOOL,80101040000,AFTON CENTRAL SCHOOL DISTRICT,4,Rural High Needs,8,CHENANGO,0,1290,DELAWARE-CHENANGO-MADISON-OTSEGO,All Students,38,31,0.82,22,0.58,7,0.18,0,0,6,0.16
2018-19,School,BAINBRIDGE-GUILFORD HIGH SCHOOL,80201040000,BAINBRIDGE-GUILFORD CENTRAL SCHOOL DISTRICT,5,Average Needs,8,CHENANGO,0,1290,DELAWARE-CHENANGO-MADISON-OTSEGO,All Students,69,64,0.93,37,0.54,27,0.39,0,0,2,0.03
2018-19,School,GREENE HIGH SCHOOL,80601040000,GREENE CENTRAL SCHOOL DISTRICT,4,Rural High Needs,8,CHENANGO,0,1290,DELAWARE-CHENANGO-MADISON-OTSEGO,All Students,73,67,0.92,28,0.38,34,0.47,0,0,4,0.05
2018-19,School,UNADILLA VALLEYSECONDARY SCHOOL,81003040000,UNADILLA VALLEY CENTRAL SCHOOL DISTRICT,4,Rural High Needs,8,CHENANGO,0,1290,DELAWARE-CHENANGO-MADISON-OTSEGO,All Students,62,55,0.89,27,0.44,24,0.39,0,0,3,0.05
2018-19,School,NORWICH HIGH SCHOOL,81200050000,NORWICH CITY SCHOOL DISTRICT,4,Rural High Needs,8,CHENANGO,0,1290,DELAWARE-CHENANGO-MADISON-OTSEGO,All Students,151,137,0.91,59,0.39,62,0.41,5,0.03,8,0.05
2018-19,School,OTSELIC VALLEY JUNIOR-SENIOR HIGH SCHOOL,81401040000,GEORGETOWN-SOUTH OTSELIC CENTRAL SCHOOL DISTRICT,4,Rural High Needs,8,CHENANGO,0,1290,DELAWARE-CHENANGO-MADISON-OTSEGO,All Students,25,0,0,0,0,0,0,0,0,1,0.04
2018-19,School,OXFORD ACADEMY HIGH SCHOOL,81501040000,OXFORD ACADEMY AND CENTRAL SCHOOL DISTRICT,4,Rural High Needs,8,CHENANGO,0,1290,DELAWARE-CHENANGO-MADISON-OTSEGO,All Students,49,45,0.92,23,0.47,21,0.43,0,0,0,0
2018-19,School,SHERBURNE-EARLVILLE SENIOR HIGH SCHOOL,82001040000,SHERBURNE-EARLVILLE CENTRAL SCHOOL DISTRICT,4,Rural High Needs,8,CHENANGO,0,1290,DELAWARE-CHENANGO-MADISON-OTSEGO,All Students,90,84,0.93,32,0.36,42,0.47,1,0.01,3,0.03
2018-19,School,AUSABLE VALLEY HIGH SCHOOL,90201040000,AUSABLE VALLEY CENTRAL SCHOOL DISTRICT,5,Average Needs,9,CLINTON,0,990,CLINTON-ESSEX-WARREN-WASHINGTON,All Students,87,70,0.8,39,0.45,18,0.21,0,0,9,0.1
2018-19,School,BEEKMANTOWN HIGH SCHOOL,90301060000,BEEKMANTOWN CENTRAL SCHOOL DISTRICT,5,Average Needs,9,CLINTON,0,990,CLINTON-ESSEX-WARREN-WASHINGTON,All Students,153,136,0.89,81,0.53,41,0.27,0,0,7,0.05
2018-19,School,NORTHEASTERN CLINTON SENIOR HIGH SCHOOL,90501040000,NORTHEASTERN CLINTON CENTRAL SCHOOL DISTRICT,5,Average Needs,9,CLINTON,0,990,CLINTON-ESSEX-WARREN-WASHINGTON,All Students,115,94,0.82,52,0.45,37,0.32,0,0,12,0.1
2018-19,School,CHAZY CENTRAL RURAL JUNIOR-SENIOR HIGH SCHOOL,90601020000,CHAZY UNION FREE SCHOOL DISTRICT,5,Average Needs,9,CLINTON,0,990,CLINTON-ESSEX-WARREN-WASHINGTON,All Students,31,26,0.84,11,0.35,15,0.48,0,0,4,0.13
2018-19,School,NORTHERN ADIRONDACK JUNIOR-SENIOR HIGH SCHOOL,90901040000,NORTHERN ADIRONDACK CENTRAL SCHOOL DISTRICT,4,Rural High Needs,9,CLINTON,0,990,CLINTON-ESSEX-WARREN-WASHINGTON,All Students,60,53,0.88,30,0.5,22,0.37,0,0,6,0.1
2018-19,School,PERU JR/SR HIGH SCHOOL,91101060000,PERU CENTRAL SCHOOL DISTRICT,5,Average Needs,9,CLINTON,0,990,CLINTON-ESSEX-WARREN-WASHINGTON,All Students,154,140,0.91,70,0.45,55,0.36,0,0,7,0.05
2018-19,School,PLATTSBURGH SENIOR HIGH SCHOOL,91200010000,PLATTSBURGH CITY SCHOOL DISTRICT,3,Urban-Suburban High Needs,9,CLINTON,0,990,CLINTON-ESSEX-WARREN-WASHINGTON,All Students,132,110,0.83,58,0.44,39,0.3,0,0,14,0.11
2018-19,School,SARANAC HIGH SCHOOL,91402060000,SARANAC CENTRAL SCHOOL DISTRICT,5,Average Needs,9,CLINTON,0,990,CLINTON-ESSEX-WARREN-WASHINGTON,All Students,106,91,0.86,45,0.42,42,0.4,0,0,9,0.08
2018-19,School,BERKSHIRE JUNIOR-SENIOR HIGH SCHOOL,1.00308E+11,BERKSHIRE UNION FREE SCHOOL DISTRICT,5,Average Needs,10,COLUMBIA,0,4990,RENSSELAER-COLUMBIA-GREENE(QUESTAR III),All Students,5,0,0,0,0,0,0,1,0.2,0,0
2018-19,School,TACONIC HILLSJUNIOR/SENIOR HIGH SCHOOL,1.00501E+11,TACONIC HILLS CENTRAL SCHOOL DISTRICT,5,Average Needs,10,COLUMBIA,0,4990,RENSSELAER-COLUMBIA-GREENE(QUESTAR III),All Students,106,85,0.8,46,0.43,27,0.25,3,0.03,8,0.08
2018-19,School,GERMANTOWN JUNIOR-SENIOR HIGH SCHOOL,1.00902E+11,GERMANTOWN CENTRAL SCHOOL DISTRICT,5,Average Needs,10,COLUMBIA,0,4990,RENSSELAER-COLUMBIA-GREENE(QUESTAR III),All Students,45,37,0.82,22,0.49,13,0.29,0,0,5,0.11
2018-19,School,CHATHAM HIGH SCHOOL,1.01001E+11,CHATHAM CENTRAL SCHOOL DISTRICT,5,Average Needs,10,COLUMBIA,0,4990,RENSSELAER-COLUMBIA-GREENE(QUESTAR III),All Students,90,83,0.92,38,0.42,40,0.44,0,0,5,0.06
2018-19,School,HUDSON SENIOR HIGH SCHOOL,1.013E+11,HUDSON CITY SCHOOL DISTRICT,4,Rural High Needs,10,COLUMBIA,0,4990,RENSSELAER-COLUMBIA-GREENE(QUESTAR III),All Students,105,85,0.81,53,0.5,23,0.22,4,0.04,4,0.04
2018-19,School,ICHABOD CRANE SENIOR HIGH SCHOOL,1.01401E+11,KINDERHOOK CENTRAL SCHOOL DISTRICT,5,Average Needs,10,COLUMBIA,0,4990,RENSSELAER-COLUMBIA-GREENE(QUESTAR III),All Students,137,130,0.95,57,0.42,70,0.51,0,0,5,0.04
2018-19,School,NEW LEBANON JUNIOR-SENIOR HIGH SCHOOL,1.01601E+11,NEW LEBANON CENTRAL SCHOOL DISTRICT,5,Average Needs,10,COLUMBIA,0,4990,RENSSELAER-COLUMBIA-GREENE(QUESTAR III),All Students,28,26,0.93,12,0.43,12,0.43,0,0,1,0.04
2018-19,School,CINCINNATUS HIGH SCHOOL,1.10101E+11,CINCINNATUS CENTRAL SCHOOL DISTRICT,4,Rural High Needs,11,CORTLAND,0,4290,ONONDAGA-CORTLAND-MADISON,All Students,30,28,0.93,21,0.7,7,0.23,0,0,0,0
2018-19,School,CORTLAND SENIOR HIGH SCHOOL,1.102E+11,CORTLAND CITY SCHOOL DISTRICT,3,Urban-Suburban High Needs,11,CORTLAND,0,4290,ONONDAGA-CORTLAND-MADISON,All Students,198,164,0.83,96,0.48,50,0.25,6,0.03,21,0.11
2018-19,School,MCGRAW SECONDARY SCHOOL,1.10304E+11,MCGRAW CENTRAL SCHOOL DISTRICT,4,Rural High Needs,11,CORTLAND,0,4290,ONONDAGA-CORTLAND-MADISON,All Students,44,42,0.95,25,0.57,8,0.18,0,0,2,0.05
2018-19,School,HOMER SENIOR HIGH SCHOOL,1.10701E+11,HOMER CENTRAL SCHOOL DISTRICT,5,Average Needs,11,CORTLAND,0,4290,ONONDAGA-CORTLAND-MADISON,All Students,154,142,0.92,64,0.42,71,0.46,1,0.01,6,0.04
2018-19,School,MARATHON HIGH SCHOOL,1.10901E+11,MARATHON CENTRAL SCHOOL DISTRICT,4,Rural High Needs,11,CORTLAND,0,4290,ONONDAGA-CORTLAND-MADISON,All Students,47,42,0.89,29,0.62,12,0.26,1,0.02,2,0.04
2018-19,School,ANDES CENTRAL SCHOOL,1.20102E+11,ANDES CENTRAL SCHOOL DISTRICT,5,Average Needs,12,DELAWARE,0,1990,OTSEGO-DELAWARE-SCHOHARIE-GREENE,All Students,6,5,0.83,2,0.33,2,0.33,0,0,1,0.17
2018-19,School,DOWNSVILLE CENTRAL SCHOOL,1.20301E+11,DOWNSVILLE CENTRAL SCHOOL DISTRICT,4,Rural High Needs,12,DELAWARE,0,1290,DELAWARE-CHENANGO-MADISON-OTSEGO,All Students,19,17,0.89,15,0.79,2,0.11,0,0,1,0.05
2018-19,School,CHARLOTTE VALLEY SCHOOL,1.20401E+11,CHARLOTTE VALLEY CENTRAL SCHOOL DISTRICT,4,Rural High Needs,12,DELAWARE,0,1990,OTSEGO-DELAWARE-SCHOHARIE-GREENE,All Students,20,0,0,0,0,0,0,0,0,0,0
2018-19,School,DELAWARE ACADEMY HIGH SCHOOL,1.20501E+11,DELAWARE ACADEMY CENTRAL SCHOOL DISTRICT AT DELHI,5,Average Needs,12,DELAWARE,0,1290,DELAWARE-CHENANGO-MADISON-OTSEGO,All Students,57,45,0.79,22,0.39,18,0.32,0,0,7,0.12
2018-19,School,FRANKLIN CENTRAL SCHOOL,1.20701E+11,FRANKLIN CENTRAL SCHOOL DISTRICT,4,Rural High Needs,12,DELAWARE,0,1290,DELAWARE-CHENANGO-MADISON-OTSEGO,All Students,25,25,1,18,0.72,6,0.24,0,0,0,0
2018-19,School,HANCOCK JUNIOR-SENIOR HIGH SCHOOL,1.20906E+11,HANCOCK CENTRAL SCHOOL DISTRICT,4,Rural High Needs,12,DELAWARE,0,1290,DELAWARE-CHENANGO-MADISON-OTSEGO,All Students,26,24,0.92,15,0.58,9,0.35,0,0,1,0.04
2018-19,School,MARGARETVILLE CENTRAL SCHOOL,1.21401E+11,MARGARETVILLE CENTRAL SCHOOL DISTRICT,4,Rural High Needs,12,DELAWARE,0,1990,OTSEGO-DELAWARE-SCHOHARIE-GREENE,All Students,18,18,1,12,0.67,5,0.28,0,0,0,0
2018-19,School,ROXBURY CENTRAL SCHOOL,1.21502E+11,ROXBURY CENTRAL SCHOOL DISTRICT,5,Average Needs,12,DELAWARE,0,1990,OTSEGO-DELAWARE-SCHOHARIE-GREENE,All Students,11,11,1,5,0.45,5,0.45,0,0,0,0
2018-19,School,SIDNEY HIGH SCHOOL,1.21601E+11,SIDNEY CENTRAL SCHOOL DISTRICT,4,Rural High Needs,12,DELAWARE,0,1290,DELAWARE-CHENANGO-MADISON-OTSEGO,All Students,72,68,0.94,33,0.46,28,0.39,0,0,1,0.01
2018-19,School,STAMFORD CENTRAL SCHOOL,1.21701E+11,STAMFORD CENTRAL SCHOOL DISTRICT,4,Rural High Needs,12,DELAWARE,0,1990,OTSEGO-DELAWARE-SCHOHARIE-GREENE,All Students,19,15,0.79,7,0.37,8,0.42,0,0,1,0.05
2018-19,School,SOUTH KORTRIGHT CENTRAL SCHOOL,1.21702E+11,SOUTH KORTRIGHT CENTRAL SCHOOL DISTRICT,5,Average Needs,12,DELAWARE,0,1990,OTSEGO-DELAWARE-SCHOHARIE-GREENE,All Students,29,27,0.93,15,0.52,9,0.31,0,0,1,0.03
2018-19,School,WALTON HIGH SCHOOL,1.21901E+11,WALTON CENTRAL SCHOOL DISTRICT,4,Rural High Needs,12,DELAWARE,0,1290,DELAWARE-CHENANGO-MADISON-OTSEGO,All Students,69,63,0.91,33,0.48,19,0.28,0,0,5,0.07
2018-19,School,BEACON HIGH SCHOOL,1.302E+11,BEACON CITY SCHOOL DISTRICT,5,Average Needs,13,DUTCHESS,0,1390,DUTCHESS,All Students,233,203,0.87,89,0.38,85,0.36,0,0,14,0.06
2018-19,School,DOVER HIGH SCHOOL,1.30502E+11,DOVER UNION FREE SCHOOL DISTRICT,5,Average Needs,13,DUTCHESS,0,1390,DUTCHESS,All Students,94,79,0.84,42,0.45,34,0.36,0,0,9,0.1
2018-19,School,FRANKLIN D ROOSEVELT SENIOR HIGH SCHOOL,1.30801E+11,HYDE PARK CENTRAL SCHOOL DISTRICT,5,Average Needs,13,DUTCHESS,0,1390,DUTCHESS,All Students,353,296,0.84,154,0.44,129,0.37,1,0,28,0.08
