report_school_year,aggregation_type,School,lea_beds,District,nrc_code,District_Desc,county_code,county_name,nyc_ind,boces_code,boces_name,subgroup_name,enrollment_count,graduation_count,graduation_percentage,regents_diploma_count,regents_diploma_percentage,advanced_regents_diploma_count,advanced_regents_diploma_percentage,ged_count,ged_percentage,dropout_count,dropout_percentage
2018-19,School,EAST BRONX ACADEMY FOR THE FUTURE,3.212E+11,NEW YORK CITY GEOGRAPHIC DISTRICT #12,1,NYC,32,BRONX,1,3090,NEW YORK CITY,All Students,114,86,0.75,71,0.62,6,0.05,4,0.04,12,0.11
2018-19,School,PAN AMERICAN INTERNATIONAL HIGH SCHOOL AT MONROE,3.212E+11,NEW YORK CITY GEOGRAPHIC DISTRICT #12,1,NYC,32,BRONX,1,3090,NEW YORK CITY,All Students,117,99,0.85,96,0.82,0,0,0,0,10,0.09
2018-19,School,ARTURO SCHOMBURG SATELLITE ACADEMY-BRONX,3.212E+11,NEW YORK CITY GEOGRAPHIC DISTRICT #12,1,NYC,32,BRONX,1,3090,NEW YORK CITY,All Students,104,26,0.25,24,0.23,0,0,5,0.05,20,0.19
2018-19,School,THE CINEMA SCHOOL,3.212E+11,NEW YORK CITY GEOGRAPHIC DISTRICT #12,1,NYC,32,BRONX,1,3090,NEW YORK CITY,All Students,67,66,0.99,54,0.81,3,0.04,0,0,0,0
2018-19,School,BRONX CAREER AND COLLEGE PREPARATORY HIGH SCHOOL,3.212E+11,NEW YORK CITY GEOGRAPHIC DISTRICT #12,1,NYC,32,BRONX,1,3090,NEW YORK CITY,All Students,83,49,0.59,40,0.48,1,0.01,2,0.02,17,0.2
2018-19,School,BRONX REGIONAL HIGH SCHOOL,3.212E+11,NEW YORK CITY GEOGRAPHIC DISTRICT #12,1,NYC,32,BRONX,1,3090,NEW YORK CITY,All Students,77,9,0.12,9,0.12,0,0,6,0.08,16,0.21
2018-19,School,BRONX ENVISION ACADEMY,3.212E+11,NEW YORK CITY GEOGRAPHIC DISTRICT #12,1,NYC,32,BRONX,1,3090,NEW YORK CITY,All Students,107,79,0.74,54,0.5,9,0.08,5,0.05,11,0.1
2018-19,School,METROPOLITAN SOUNDVIEW HIGH SCHOOL (THE),3.212E+11,NEW YORK CITY GEOGRAPHIC DISTRICT #12,1,NYC,32,BRONX,1,3090,NEW YORK CITY,All Students,108,78,0.72,62,0.57,2,0.02,2,0.02,17,0.16
2018-19,School,HIGH SCHOOL OF WORLD CULTURES,3.212E+11,NEW YORK CITY GEOGRAPHIC DISTRICT #12,1,NYC,32,BRONX,1,3090,NEW YORK CITY,All Students,114,66,0.58,59,0.52,7,0.06,1,0.01,19,0.17
2018-19,School,FANNIE LOU HAMER FREEDOM SCHOOL,3.212E+11,NEW YORK CITY GEOGRAPHIC DISTRICT #12,1,NYC,32,BRONX,1,3090,NEW YORK CITY,All Students,122,89,0.73,83,0.68,0,0,2,0.02,16,0.13
2018-19,School,WINGS ACADEMY,3.212E+11,NEW YORK CITY GEOGRAPHIC DISTRICT #12,1,NYC,32,BRONX,1,3090,NEW YORK CITY,All Students,93,58,0.62,48,0.52,0,0,0,0,17,0.18
2018-19,School,MONROE ACADEMY FOR VISUAL ARTS & DESIGN,3.212E+11,NEW YORK CITY GEOGRAPHIC DISTRICT #12,1,NYC,32,BRONX,1,3090,NEW YORK CITY,All Students,9,0,0,0,0,0,0,1,0.11,8,0.89
2018-19,School,BRONX LIGHTHOUSE CHARTER SCHOOL,3.21201E+11,BRONX LIGHTHOUSE CHARTER SCHOOL,7,Charters,32,BRONX,1,3090,NEW YORK CITY,All Students,58,51,0.88,41,0.71,10,0.17,2,0.03,3,0.05
2018-19,School,DR RICHARD IZQUIERDO HEALTH AND SCIENCE CHARTER SCHOOL,3.21201E+11,DR RICHARD IZQUIERDO HEALTH AND SCIENCE CHARTER SCHOOL,7,Charters,32,BRONX,1,3090,NEW YORK CITY,All Students,80,64,0.8,32,0.4,29,0.36,0,0,0,0
2018-19,School,ROADS CHARTER SCHOOL II,3.21201E+11,NEW VISIONS AIM CHARTER HIGH SCHOOL II,7,Charters,32,BRONX,1,3090,NEW YORK CITY,All Students,86,17,0.2,2,0.02,0,0,4,0.05,25,0.29
2018-19,School,DR SUSAN S MCKINNEY SECONDARY SCHOOL,3.313E+11,NEW YORK CITY GEOGRAPHIC DISTRICT #13,1,NYC,33,KINGS,1,3090,NEW YORK CITY,All Students,55,38,0.69,31,0.56,1,0.02,0,0,1,0.02
2018-19,School,URBAN ASSEMBLY SCHOOL FOR MUSIC AND ART,3.313E+11,NEW YORK CITY GEOGRAPHIC DISTRICT #13,1,NYC,33,KINGS,1,3090,NEW YORK CITY,All Students,50,43,0.86,30,0.6,0,0,0,0,3,0.06
2018-19,School,BROOKLYN COMMUNITY ARTS AND MEDIA HIGH SCHOOL,3.313E+11,NEW YORK CITY GEOGRAPHIC DISTRICT #13,1,NYC,33,KINGS,1,3090,NEW YORK CITY,All Students,87,72,0.83,61,0.7,0,0,1,0.01,9,0.1
2018-19,School,SCIENCE SKILLS CENTER HIGH SCHOOL FOR SCI  TECH AND CREATIVE,3.313E+11,NEW YORK CITY GEOGRAPHIC DISTRICT #13,1,NYC,33,KINGS,1,3090,NEW YORK CITY,All Students,110,105,0.95,86,0.78,10,0.09,0,0,3,0.03
2018-19,School,BROOKLYN TECHNICAL HIGH SCHOOL,3.313E+11,NEW YORK CITY GEOGRAPHIC DISTRICT #13,1,NYC,33,KINGS,1,3090,NEW YORK CITY,All Students,1417,1372,0.97,116,0.08,1256,0.89,1,0,5,0
2018-19,School,BROOKLYN INTERNATIONAL HIGH SCHOOL AT WATERS EDGE,3.313E+11,NEW YORK CITY GEOGRAPHIC DISTRICT #13,1,NYC,33,KINGS,1,3090,NEW YORK CITY,All Students,105,77,0.73,73,0.7,0,0,0,0,11,0.1
2018-19,School,URBAN ASSEMBLY SCHOOL FOR LAW AND JUSTICE,3.313E+11,NEW YORK CITY GEOGRAPHIC DISTRICT #13,1,NYC,33,KINGS,1,3090,NEW YORK CITY,All Students,96,92,0.96,85,0.89,0,0,0,0,2,0.02
2018-19,School,DEAN STREET SCHOOL (THE),3.313E+11,NEW YORK CITY GEOGRAPHIC DISTRICT #13,1,NYC,33,KINGS,1,3090,NEW YORK CITY,All Students,44,32,0.73,25,0.57,0,0,0,0,3,0.07
2018-19,School,URBAN ASSEMBLY INSTITUTE OF MATH AND SCIENCE FOR YOUNG WOMEN,3.313E+11,NEW YORK CITY GEOGRAPHIC DISTRICT #13,1,NYC,33,KINGS,1,3090,NEW YORK CITY,All Students,70,63,0.9,42,0.6,4,0.06,0,0,1,0.01
2018-19,School,BROOKLYN ACADEMY HIGH SCHOOL,3.313E+11,NEW YORK CITY GEOGRAPHIC DISTRICT #13,1,NYC,33,KINGS,1,3090,NEW YORK CITY,All Students,89,15,0.17,8,0.09,0,0,1,0.01,28,0.31
2018-19,School,BEDFORD STUYVESANT PREPRETORY HIGH SCHOOL,3.313E+11,NEW YORK CITY GEOGRAPHIC DISTRICT #13,1,NYC,33,KINGS,1,3090,NEW YORK CITY,All Students,-,-,-,-,-,-,-,-,-,-,-
2018-19,School,BEDFORD ACADEMY HIGH SCHOOL,3.313E+11,NEW YORK CITY GEOGRAPHIC DISTRICT #13,1,NYC,33,KINGS,1,3090,NEW YORK CITY,All Students,72,71,0.99,59,0.82,12,0.17,0,0,0,0
2018-19,School,GEORGE WESTINGHOUSE CAREER & TECHNICAL ED HIGH SCHOOL,3.313E+11,NEW YORK CITY GEOGRAPHIC DISTRICT #13,1,NYC,33,KINGS,1,3090,NEW YORK CITY,All Students,144,133,0.92,104,0.72,9,0.06,1,0.01,3,0.02
2018-19,School,BROOKLYN HIGH SCHOOL FOR LEADERSHIP AND COMMUNITY,3.313E+11,NEW YORK CITY GEOGRAPHIC DISTRICT #13,1,NYC,33,KINGS,1,3090,NEW YORK CITY,All Students,62,4,0.06,2,0.03,0,0,0,0,8,0.13
2018-19,School,BENJAMIN BANNEKER ACADEMY,3.313E+11,NEW YORK CITY GEOGRAPHIC DISTRICT #13,1,NYC,33,KINGS,1,3090,NEW YORK CITY,All Students,190,186,0.98,130,0.68,52,0.27,0,0,1,0.01
2018-19,School,CITY POLYTECHNIC HIGH SCHOOL OF ENGINEERING  ARCHITECTURE AN,3.313E+11,NEW YORK CITY GEOGRAPHIC DISTRICT #13,1,NYC,33,KINGS,1,3090,NEW YORK CITY,All Students,83,71,0.86,65,0.78,0,0,1,0.01,4,0.05
2018-19,School,LEADERSHIP PREPARATORY CHARTER SCHOOL,3.31301E+11,LEADERSHIP PREPARATORY BEDFORD STUYVESANT CHARTER SCHOOL,7,Charters,33,KINGS,1,3090,NEW YORK CITY,All Students,55,44,0.8,42,0.76,2,0.04,1,0.02,0,0
2018-19,School,URBAN DOVE CHARTER SCHOOL,3.31301E+11,URBAN DOVE TEAM CHARTER SCHOOL,7,Charters,33,KINGS,1,3090,NEW YORK CITY,All Students,77,9,0.12,5,0.06,0,0,0,0,14,0.18
2018-19,School,UNITY PREPARATORY CHARTER SCHOOL OF BROOKLYN,3.31301E+11,UNITY PREPARATORY CHARTER SCHOOL OF BROOKLYN,7,Charters,33,KINGS,1,3090,NEW YORK CITY,All Students,-,-,-,-,-,-,-,-,-,-,-
2018-19,School,JHS 71 JUAN MOREL CAMPOS,3.314E+11,NEW YORK CITY GEOGRAPHIC DISTRICT #14,1,NYC,33,KINGS,1,3090,NEW YORK CITY,All Students,97,58,0.6,48,0.49,1,0.01,2,0.02,14,0.14
2018-19,School,BROOKLYN LATIN SCHOOL (THE),3.314E+11,NEW YORK CITY GEOGRAPHIC DISTRICT #14,1,NYC,33,KINGS,1,3090,NEW YORK CITY,All Students,156,152,0.97,51,0.33,101,0.65,0,0,0,0
2018-19,School,WILLIAMSBURG HIGH SCHOOL FOR ART AND TECHNOLOGY,3.314E+11,NEW YORK CITY GEOGRAPHIC DISTRICT #14,1,NYC,33,KINGS,1,3090,NEW YORK CITY,All Students,71,58,0.82,37,0.52,0,0,0,0,10,0.14
2018-19,School,PROGRESS HIGH SCHOOL,3.314E+11,NEW YORK CITY GEOGRAPHIC DISTRICT #14,1,NYC,33,KINGS,1,3090,NEW YORK CITY,All Students,222,170,0.77,133,0.6,0,0,0,0,18,0.08
2018-19,School,SCHOOL FOR LEGAL STUDIES,3.314E+11,NEW YORK CITY GEOGRAPHIC DISTRICT #14,1,NYC,33,KINGS,1,3090,NEW YORK CITY,All Students,84,63,0.75,24,0.29,0,0,2,0.02,6,0.07
2018-19,School,HIGH SCHOOL OF ENTERPRISE  BUSINESS & TECHNOLOGY,3.314E+11,NEW YORK CITY GEOGRAPHIC DISTRICT #14,1,NYC,33,KINGS,1,3090,NEW YORK CITY,All Students,179,143,0.8,111,0.62,7,0.04,1,0.01,17,0.09
2018-19,School,BROOKLYN PREPARATORY HIGH SCHOOL,3.314E+11,NEW YORK CITY GEOGRAPHIC DISTRICT #14,1,NYC,33,KINGS,1,3090,NEW YORK CITY,All Students,138,129,0.93,116,0.84,0,0,1,0.01,1,0.01
2018-19,School,WILLIAMSBURG HIGH SCHOOL FOR ARCHITECTURE AND DESIGN,3.314E+11,NEW YORK CITY GEOGRAPHIC DISTRICT #14,1,NYC,33,KINGS,1,3090,NEW YORK CITY,All Students,124,120,0.97,108,0.87,12,0.1,1,0.01,1,0.01
2018-19,School,WILLIAMSBURG PREPARATORY SCHOOL,3.314E+11,NEW YORK CITY GEOGRAPHIC DISTRICT #14,1,NYC,33,KINGS,1,3090,NEW YORK CITY,All Students,151,145,0.96,106,0.7,27,0.18,0,0,1,0.01
2018-19,School,LYONS COMMUNITY SCHOOL,3.314E+11,NEW YORK CITY GEOGRAPHIC DISTRICT #14,1,NYC,33,KINGS,1,3090,NEW YORK CITY,All Students,76,55,0.72,55,0.72,0,0,0,0,4,0.05
2018-19,School,AUTOMOTIVE HIGH SCHOOL,3.314E+11,NEW YORK CITY GEOGRAPHIC DISTRICT #14,1,NYC,33,KINGS,1,3090,NEW YORK CITY,All Students,79,56,0.71,42,0.53,0,0,4,0.05,9,0.11
2018-19,School,YOUNG WOMEN'S LEADERSHIP SCHOOL OF BROOKLYN,3.314E+11,NEW YORK CITY GEOGRAPHIC DISTRICT #14,1,NYC,33,KINGS,1,3090,NEW YORK CITY,All Students,31,30,0.97,20,0.65,8,0.26,0,0,1,0.03
2018-19,School,EL PUENTE ACADEMY FOR PEACE AND JUSTICE,3.314E+11,NEW YORK CITY GEOGRAPHIC DISTRICT #14,1,NYC,33,KINGS,1,3090,NEW YORK CITY,All Students,56,44,0.79,44,0.79,0,0,0,0,2,0.04
2018-19,School,WILLIAMSBURG CHARTER HIGH SCHOOL,3.31401E+11,WILLIAMSBURG CHARTER HIGH SCHOOL,7,Charters,33,KINGS,1,3090,NEW YORK CITY,All Students,258,212,0.82,180,0.7,6,0.02,3,0.01,4,0.02
2018-19,School,BELIEVE NORTHSIDE CHARTER HIGH SCHOOL,3.31401E+11,NORTHSIDE CHARTER HIGH SCHOOL,7,Charters,33,KINGS,1,3090,NEW YORK CITY,All Students,87,75,0.86,63,0.72,2,0.02,0,0,2,0.02
2018-19,School,BROOKLYN SECONDARY SCHOOL FOR COLLABORATIVE STUDIES,3.315E+11,NEW YORK CITY GEOGRAPHIC DISTRICT #15,1,NYC,33,KINGS,1,3090,NEW YORK CITY,All Students,95,85,0.89,85,0.89,0,0,0,0,6,0.06
2018-19,School,BROOKLYN FRONTIERS HIGH SCHOOL,3.315E+11,NEW YORK CITY GEOGRAPHIC DISTRICT #15,1,NYC,33,KINGS,1,3090,NEW YORK CITY,All Students,101,18,0.18,11,0.11,0,0,4,0.04,43,0.43
2018-19,School,BROOKLYN SCHOOL FOR GLOBAL STUDIES,3.315E+11,NEW YORK CITY GEOGRAPHIC DISTRICT #15,1,NYC,33,KINGS,1,3090,NEW YORK CITY,All Students,43,42,0.98,32,0.74,1,0.02,0,0,0,0
2018-19,School,SECONDARY SCHOOL FOR LAW,3.315E+11,NEW YORK CITY GEOGRAPHIC DISTRICT #15,1,NYC,33,KINGS,1,3090,NEW YORK CITY,All Students,75,68,0.91,53,0.71,5,0.07,1,0.01,2,0.03
2018-19,School,SECONDARY SCHOOL FOR JOURNALISM,3.315E+11,NEW YORK CITY GEOGRAPHIC DISTRICT #15,1,NYC,33,KINGS,1,3090,NEW YORK CITY,All Students,58,38,0.66,37,0.64,0,0,1,0.02,11,0.19
2018-19,School,SECONDARY SCHOOL FOR RESEARCH,3.315E+11,NEW YORK CITY GEOGRAPHIC DISTRICT #15,1,NYC,33,KINGS,1,3090,NEW YORK CITY,All Students,98,84,0.86,66,0.67,2,0.02,0,0,4,0.04
2018-19,School,BOERUM SCHOOL FOR INTERNATIONAL STUDIES (THE),3.315E+11,NEW YORK CITY GEOGRAPHIC DISTRICT #15,1,NYC,33,KINGS,1,3090,NEW YORK CITY,All Students,51,37,0.73,36,0.71,0,0,0,0,0,0
2018-19,School,COBBLE HILL SCHOOL FOR AMERICAN STUDIES,3.315E+11,NEW YORK CITY GEOGRAPHIC DISTRICT #15,1,NYC,33,KINGS,1,3090,NEW YORK CITY,All Students,145,126,0.87,92,0.63,3,0.02,1,0.01,6,0.04
2018-19,School,WEST BROOKLYN COMMUNITY HIGH SCHOOL,3.315E+11,NEW YORK CITY GEOGRAPHIC DISTRICT #15,1,NYC,33,KINGS,1,3090,NEW YORK CITY,All Students,89,5,0.06,2,0.02,0,0,4,0.04,13,0.15
2018-19,School,KHALIL GIBRAN INTERNATIONAL ACADEMY,3.315E+11,NEW YORK CITY GEOGRAPHIC DISTRICT #15,1,NYC,33,KINGS,1,3090,NEW YORK CITY,All Students,67,37,0.55,27,0.4,4,0.06,0,0,4,0.06
2018-19,School,BROOKLYN HIGH SCHOOL FOR THE ARTS,3.315E+11,NEW YORK CITY GEOGRAPHIC DISTRICT #15,1,NYC,33,KINGS,1,3090,NEW YORK CITY,All Students,197,180,0.91,151,0.77,17,0.09,1,0.01,3,0.02
2018-19,School,SUNSET PARK HIGH SCHOOL,3.315E+11,NEW YORK CITY GEOGRAPHIC DISTRICT #15,1,NYC,33,KINGS,1,3090,NEW YORK CITY,All Students,286,237,0.83,163,0.57,38,0.13,1,0,16,0.06
2018-19,School,MILLENNIUM BROOKLYN,3.315E+11,NEW YORK CITY GEOGRAPHIC DISTRICT #15,1,NYC,33,KINGS,1,3090,NEW YORK CITY,All Students,159,157,0.99,49,0.31,108,0.68,0,0,1,0.01
2018-19,School,SOUTH BROOKLYN COMMUNITY HS FOR LEADERSHIP,3.315E+11,NEW YORK CITY GEOGRAPHIC DISTRICT #15,1,NYC,33,KINGS,1,3090,NEW YORK CITY,All Students,63,7,0.11,5,0.08,0,0,1,0.02,9,0.14
2018-19,School,BROOKLYN PROSPECT CHARTER SCHOOL,3.31501E+11,BROOKLYN PROSPECT CHARTER SCHOOL-CSD 15,7,Charters,33,KINGS,1,3090,NEW YORK CITY,All Students,84,81,0.96,71,0.85,8,0.1,0,0,0,0
2018-19,School,SUMMIT ACADEMY CHARTER SCHOOL,3.31501E+11,SUMMIT ACADEMY CHARTER SCHOOL,7,Charters,33,KINGS,1,3090,NEW YORK CITY,All Students,49,35,0.71,30,0.61,3,0.06,1,0.02,0,0
2018-19,School,NEW DAWN CHARTER HIGH SCHOOL,3.31501E+11,NEW DAWN CHARTER HIGH SCHOOL,7,Charters,33,KINGS,1,3090,NEW YORK CITY,All Students,85,23,0.27,21,0.25,0,0,1,0.01,3,0.04
2018-19,School,BOYS & GIRLS HIGH SCHOOL,3.316E+11,NEW YORK CITY GEOGRAPHIC DISTRICT #16,1,NYC,33,KINGS,1,3090,NEW YORK CITY,All Students,87,67,0.77,53,0.61,3,0.03,1,0.01,5,0.06
2018-19,School,BROOKLYN HIGH SCHOOL FOR LAW AND TECHNOLOGY,3.316E+11,NEW YORK CITY GEOGRAPHIC DISTRICT #16,1,NYC,33,KINGS,1,3090,NEW YORK CITY,All Students,126,100,0.79,77,0.61,0,0,0,0,2,0.02
2018-19,School,GOTHAM PROFESSIONAL ARTS ACADEMY,3.316E+11,NEW YORK CITY GEOGRAPHIC DISTRICT #16,1,NYC,33,KINGS,1,3090,NEW YORK CITY,All Students,-,-,-,-,-,-,-,-,-,-,-
2018-19,School,RESEARCH AND SERVICE HIGH SCHOOL,3.316E+11,NEW YORK CITY GEOGRAPHIC DISTRICT #16,1,NYC,33,KINGS,1,3090,NEW YORK CITY,All Students,141,41,0.29,30,0.21,0,0,3,0.02,16,0.11
2018-19,School,THE BROOKLYN ACADEMY OF GLOBAL FINANCE,3.316E+11,NEW YORK CITY GEOGRAPHIC DISTRICT #16,1,NYC,33,KINGS,1,3090,NEW YORK CITY,All Students,22,17,0.77,6,0.27,0,0,0,0,3,0.14
2018-19,School,NELSON MANDELA HIGH SCHOOL,3.316E+11,NEW YORK CITY GEOGRAPHIC DISTRICT #16,1,NYC,33,KINGS,1,3090,NEW YORK CITY,All Students,66,54,0.82,39,0.59,0,0,1,0.02,4,0.06
2018-19,School,EXCELLENCE GIRLS CHARTER SCHOOL,3.31601E+11,EXCELLENCE GIRLS CHARTER SCHOOL,7,Charters,33,KINGS,1,3090,NEW YORK CITY,All Students,93,86,0.92,82,0.88,0,0,1,0.01,0,0
2018-19,School,PATHWAYS IN TECHNOLOGY EARLY COLLEGE HIGH SCHOOL,3.317E+11,NEW YORK CITY GEOGRAPHIC DISTRICT #17,1,NYC,33,KINGS,1,3090,NEW YORK CITY,All Students,116,89,0.77,84,0.72,0,0,0,0,3,0.03
2018-19,School,ACAD FOR COLLEGE PREP & CAREER EXPLORATION: A COLLEGE BOARD,3.317E+11,NEW YORK CITY GEOGRAPHIC DISTRICT #17,1,NYC,33,KINGS,1,3090,NEW YORK CITY,All Students,62,50,0.81,40,0.65,3,0.05,0,0,9,0.15
2018-19,School,ACADEMY OF HOSPITALITY AND TOURISM,3.317E+11,NEW YORK CITY GEOGRAPHIC DISTRICT #17,1,NYC,33,KINGS,1,3090,NEW YORK CITY,All Students,36,32,0.89,23,0.64,0,0,0,0,2,0.06
2018-19,School,W E B DUBOIS ACADEMIC HIGH SCHOOL,3.317E+11,NEW YORK CITY GEOGRAPHIC DISTRICT #17,1,NYC,33,KINGS,1,3090,NEW YORK CITY,All Students,10,4,0.4,3,0.3,0,0,0,0,6,0.6
2018-19,School,INTERNATIONAL HIGH SCHOOL AT PROSPECT HEIGHTS,3.317E+11,NEW YORK CITY GEOGRAPHIC DISTRICT #17,1,NYC,33,KINGS,1,3090,NEW YORK CITY,All Students,104,59,0.57,52,0.5,0,0,0,0,14,0.13
2018-19,School,HIGH SCHOOL FOR GLOBAL CITIZENSHIP (THE),3.317E+11,NEW YORK CITY GEOGRAPHIC DISTRICT #17,1,NYC,33,KINGS,1,3090,NEW YORK CITY,All Students,37,31,0.84,24,0.65,0,0,0,0,4,0.11
2018-19,School,THE SCHOOL FOR HUMAN RIGHTS,3.317E+11,NEW YORK CITY GEOGRAPHIC DISTRICT #17,1,NYC,33,KINGS,1,3090,NEW YORK CITY,All Students,104,85,0.82,72,0.69,2,0.02,1,0.01,7,0.07
2018-19,School,SCHOOL FOR DEMOCRACY AND LEADERSHIP,3.317E+11,NEW YORK CITY GEOGRAPHIC DISTRICT #17,1,NYC,33,KINGS,1,3090,NEW YORK CITY,All Students,-,-,-,-,-,-,-,-,-,-,-
2018-19,School,HIGH SCHOOL FOR YOUTH AND COMMUNITY DEVELOPMENT,3.317E+11,NEW YORK CITY GEOGRAPHIC DISTRICT #17,1,NYC,33,KINGS,1,3090,NEW YORK CITY,All Students,98,81,0.83,60,0.61,3,0.03,1,0.01,10,0.1
2018-19,School,HIGH SCHOOL FOR SERVICE AND LEARNING AT ERASMUS,3.317E+11,NEW YORK CITY GEOGRAPHIC DISTRICT #17,1,NYC,33,KINGS,1,3090,NEW YORK CITY,All Students,79,62,0.78,46,0.58,1,0.01,0,0,10,0.13
2018-19,School,SCIENCE  TECHNOLOGY & RESEARCH HIGH SCHOOL AT ERASMUS,3.317E+11,NEW YORK CITY GEOGRAPHIC DISTRICT #17,1,NYC,33,KINGS,1,3090,NEW YORK CITY,All Students,90,90,1,64,0.71,25,0.28,0,0,0,0
2018-19,School,HIGH SSCHOOL FOR PUBLIC SERVICE-HEROES OF TOMORROW,3.317E+11,NEW YORK CITY GEOGRAPHIC DISTRICT #17,1,NYC,33,KINGS,1,3090,NEW YORK CITY,All Students,105,92,0.88,65,0.62,19,0.18,0,0,1,0.01
2018-19,School,BROOKLYN HS FOR SCIENCE AND THE ENVIRONMENT,3.317E+11,NEW YORK CITY GEOGRAPHIC DISTRICT #17,1,NYC,33,KINGS,1,3090,NEW YORK CITY,All Students,120,90,0.75,81,0.68,0,0,0,0,9,0.08
2018-19,School,BROOKLYN SCHOOL FOR MUSIC AND THEATER,3.317E+11,NEW YORK CITY GEOGRAPHIC DISTRICT #17,1,NYC,33,KINGS,1,3090,NEW YORK CITY,All Students,66,53,0.8,35,0.53,1,0.02,1,0.02,8,0.12
2018-19,School,BROWNSVILLE DIPLOMA PLUS HIGH SCHOOL,3.317E+11,NEW YORK CITY GEOGRAPHIC DISTRICT #17,1,NYC,33,KINGS,1,3090,NEW YORK CITY,All Students,72,19,0.26,14,0.19,0,0,1,0.01,8,0.11
2018-19,School,MEDGAR EVERS COLLEGE PREPERATORY SCHOOL,3.317E+11,NEW YORK CITY GEOGRAPHIC DISTRICT #17,1,NYC,33,KINGS,1,3090,NEW YORK CITY,All Students,197,188,0.95,103,0.52,81,0.41,1,0.01,2,0.01
2018-19,School,CLARA BARTON VOCATIONAL HIGH SCHOOL,3.317E+11,NEW YORK CITY GEOGRAPHIC DISTRICT #17,1,NYC,33,KINGS,1,3090,NEW YORK CITY,All Students,258,208,0.81,177,0.69,11,0.04,1,0,10,0.04
2018-19,School,BROOKLYN INSTITUTE FOR LIBERAL ARTS,3.317E+11,NEW YORK CITY GEOGRAPHIC DISTRICT #17,1,NYC,33,KINGS,1,3090,NEW YORK CITY,All Students,84,78,0.93,69,0.82,0,0,0,0,2,0.02
2018-19,School,ACADEMY FOR HEALTH CAREERS,3.317E+11,NEW YORK CITY GEOGRAPHIC DISTRICT #17,1,NYC,33,KINGS,1,3090,NEW YORK CITY,All Students,74,60,0.81,49,0.66,0,0,1,0.01,7,0.09
2018-19,School,ACHIEVEMENT FIRST CROWN HEIGHTS CHARTER SCHOOL,3.31701E+11,ACHIEVEMENT FIRST CROWN HEIGHTS CHARTER SCHOOL,7,Charters,33,KINGS,1,3090,NEW YORK CITY,All Students,88,85,0.97,79,0.9,0,0,0,0,0,0
2018-19,School,KIPP AMP CHARTER SCHOOL,3.31701E+11,KIPP ALWAYS MENTALLY PREPARED CHARTER SCHOOL,7,Charters,33,KINGS,1,3090,NEW YORK CITY,All Students,34,34,1,16,0.47,16,0.47,0,0,0,0
2018-19,School,I.S. 285 MEYER LEVIN,3.318E+11,NEW YORK CITY GEOGRAPHIC DISTRICT #18,1,NYC,33,KINGS,1,3090,NEW YORK CITY,All Students,-,-,-,-,-,-,-,-,-,-,-
2018-19,School,IT TAKES A VILLAGE ACADEMY (ITAVA),3.318E+11,NEW YORK CITY GEOGRAPHIC DISTRICT #18,1,NYC,33,KINGS,1,3090,NEW YORK CITY,All Students,158,137,0.87,125,0.79,3,0.02,2,0.01,8,0.05
2018-19,School,BROOKLYN GENERATION SCHOOL,3.318E+11,NEW YORK CITY GEOGRAPHIC DISTRICT #18,1,NYC,33,KINGS,1,3090,NEW YORK CITY,All Students,48,36,0.75,31,0.65,0,0,0,0,8,0.17
2018-19,School,BROOKLYN THEATRE ARTS HIGH SCHOOL,3.318E+11,NEW YORK CITY GEOGRAPHIC DISTRICT #18,1,NYC,33,KINGS,1,3090,NEW YORK CITY,All Students,77,66,0.86,58,0.75,0,0,0,0,1,0.01
2018-19,School,KURT HAHN EXPEDITIONARY LEARNING SCHOOL,3.318E+11,NEW YORK CITY GEOGRAPHIC DISTRICT #18,1,NYC,33,KINGS,1,3090,NEW YORK CITY,All Students,89,67,0.75,67,0.75,0,0,2,0.02,3,0.03
2018-19,School,VICTORY COLLEGIATE HIGH SCHOOL,3.318E+11,NEW YORK CITY GEOGRAPHIC DISTRICT #18,1,NYC,33,KINGS,1,3090,NEW YORK CITY,All Students,79,62,0.78,52,0.66,0,0,1,0.01,6,0.08
2018-19,School,BROOKLYN BRIDGE ACADEMY HIGH SHCOOL,3.318E+11,NEW YORK CITY GEOGRAPHIC DISTRICT #18,1,NYC,33,KINGS,1,3090,NEW YORK CITY,All Students,85,13,0.15,11,0.13,0,0,4,0.05,13,0.15
2018-19,School,HIGH SCHOOL FOR INNOVATION IN ADVERTISING AND MEDIA,3.318E+11,NEW YORK CITY GEOGRAPHIC DISTRICT #18,1,NYC,33,KINGS,1,3090,NEW YORK CITY,All Students,61,51,0.84,46,0.75,0,0,0,0,3,0.05
2018-19,School,CULTURAL ACADEMY FOR THE ARTS AND SCIENCES,3.318E+11,NEW YORK CITY GEOGRAPHIC DISTRICT #18,1,NYC,33,KINGS,1,3090,NEW YORK CITY,All Students,80,57,0.71,50,0.63,1,0.01,1,0.01,12,0.15
2018-19,School,HIGH SCHOOL FOR MEDIAL PROFESSIONS,3.318E+11,NEW YORK CITY GEOGRAPHIC DISTRICT #18,1,NYC,33,KINGS,1,3090,NEW YORK CITY,All Students,113,100,0.88,91,0.81,0,0,0,0,3,0.03
2018-19,School,OLYMPUS ACADEMY,3.318E+11,NEW YORK CITY GEOGRAPHIC DISTRICT #18,1,NYC,33,KINGS,1,3090,NEW YORK CITY,All Students,96,28,0.29,25,0.26,0,0,10,0.1,12,0.13
2018-19,School,ACADEMY FOR CONSERVATION AND THE ENVIRONMENT,3.318E+11,NEW YORK CITY GEOGRAPHIC DISTRICT #18,1,NYC,33,KINGS,1,3090,NEW YORK CITY,All Students,86,75,0.87,69,0.8,2,0.02,1,0.01,6,0.07
2018-19,School,URBAN ACTION ACADEMY,3.318E+11,NEW YORK CITY GEOGRAPHIC DISTRICT #18,1,NYC,33,KINGS,1,3090,NEW YORK CITY,All Students,82,54,0.66,44,0.54,1,0.01,0,0,13,0.16
2018-19,School,EAST BROOKLYN COMMUNITY HIGH SCHOOL,3.318E+11,NEW YORK CITY GEOGRAPHIC DISTRICT #18,1,NYC,33,KINGS,1,3090,NEW YORK CITY,All Students,92,23,0.25,7,0.08,0,0,1,0.01,25,0.27
2018-19,School,BROOKLYN ASCEND CHARTER SCHOOL,3.31801E+11,BROOKLYN ASCEND CHARTER SCHOOL,7,Charters,33,KINGS,1,3090,NEW YORK CITY,All Students,63,59,0.94,54,0.86,5,0.08,0,0,0,0
2018-19,School,ACADEMY FOR YOUNG WRITERS,3.319E+11,NEW YORK CITY GEOGRAPHIC DISTRICT #19,1,NYC,33,KINGS,1,3090,NEW YORK CITY,All Students,70,66,0.94,53,0.76,0,0,1,0.01,2,0.03
2018-19,School,EAST NEW YORK FAMILY ACADEMY,3.319E+11,NEW YORK CITY GEOGRAPHIC DISTRICT #19,1,NYC,33,KINGS,1,3090,NEW YORK CITY,All Students,59,57,0.97,45,0.76,1,0.02,0,0,0,0
2018-19,School,SPRING CREEK COMMUNITY SCHOOL,3.319E+11,NEW YORK CITY GEOGRAPHIC DISTRICT #19,1,NYC,33,KINGS,1,3090,NEW YORK CITY,All Students,65,62,0.95,54,0.83,0,0,0,0,2,0.03
2018-19,School,CAPTAIN VERNON A RICHARDS HIGH SCHOOL FOR FIRE AND LIFE SAFE,3.319E+11,NEW YORK CITY GEOGRAPHIC DISTRICT #19,1,NYC,33,KINGS,1,3090,NEW YORK CITY,All Students,54,44,0.81,35,0.65,3,0.06,1,0.02,7,0.13
2018-19,School,HIGH SCHOOL FOR CIVIL RIGHTS,3.319E+11,NEW YORK CITY GEOGRAPHIC DISTRICT #19,1,NYC,33,KINGS,1,3090,NEW YORK CITY,All Students,67,44,0.66,26,0.39,1,0.01,0,0,15,0.22
2018-19,School,PERFORMING ARTS AND TECHNOLOGY HIGH SCHOOL,3.319E+11,NEW YORK CITY GEOGRAPHIC DISTRICT #19,1,NYC,33,KINGS,1,3090,NEW YORK CITY,All Students,92,86,0.93,69,0.75,0,0,0,0,5,0.05
2018-19,School,WORLD ACADEMY FOR TOTAL COMMUNITY HEALTH,3.319E+11,NEW YORK CITY GEOGRAPHIC DISTRICT #19,1,NYC,33,KINGS,1,3090,NEW YORK CITY,All Students,72,53,0.74,42,0.58,3,0.04,1,0.01,10,0.14
2018-19,School,MULTICULTURAL HIGH SCHOOL,3.319E+11,NEW YORK CITY GEOGRAPHIC DISTRICT #19,1,NYC,33,KINGS,1,3090,NEW YORK CITY,All Students,63,51,0.81,37,0.59,1,0.02,0,0,6,0.1
2018-19,School,TRANSIT TECH CAREER AND TECHNICAL EDUCATION,3.319E+11,NEW YORK CITY GEOGRAPHIC DISTRICT #19,1,NYC,33,KINGS,1,3090,NEW YORK CITY,All Students,170,120,0.71,97,0.57,2,0.01,0,0,13,0.08
2018-19,School,ACADEMY OF INNOVATIVE TECHNOLOGY,3.319E+11,NEW YORK CITY GEOGRAPHIC DISTRICT #19,1,NYC,33,KINGS,1,3090,NEW YORK CITY,All Students,90,86,0.96,65,0.72,7,0.08,0,0,3,0.03
2018-19,School,BROOKLYN LAB SCHOOL,3.319E+11,NEW YORK CITY GEOGRAPHIC DISTRICT #19,1,NYC,33,KINGS,1,3090,NEW YORK CITY,All Students,75,53,0.71,25,0.33,0,0,1,0.01,15,0.2
2018-19,School,CYPRESS HILLS COLLEGIATE PREPARATORY SCHOOL,3.319E+11,NEW YORK CITY GEOGRAPHIC DISTRICT #19,1,NYC,33,KINGS,1,3090,NEW YORK CITY,All Students,48,41,0.85,26,0.54,3,0.06,0,0,4,0.08
2018-19,School,WILLIAM H MAXWELL CAREER AND TECHNICAL EDUCATION HIGH SCHOOL,3.319E+11,NEW YORK CITY GEOGRAPHIC DISTRICT #19,1,NYC,33,KINGS,1,3090,NEW YORK CITY,All Students,102,85,0.83,76,0.75,1,0.01,1,0.01,6,0.06
2018-19,School,SCHOOL FOR CLASSICS:  AN ACADEMY OF THINKERS  WRITERS AND PE,3.319E+11,NEW YORK CITY GEOGRAPHIC DISTRICT #19,1,NYC,33,KINGS,1,3090,NEW YORK CITY,All Students,73,51,0.7,36,0.49,2,0.03,0,0,15,0.21
2018-19,School,URBAN ASSEMBLY SCHOOL FOR COLLABORATIVE HEALTHCARE,3.319E+11,NEW YORK CITY GEOGRAPHIC DISTRICT #19,1,NYC,33,KINGS,1,3090,NEW YORK CITY,All Students,73,62,0.85,45,0.62,0,0,1,0.01,7,0.1
2018-19,School,ACHIEVEMENT FIRST EAST NEW YORK CHARTER SCHOOL,3.31901E+11,ACHIEVEMENT FIRST EAST NEW YORK CHARTER SCHOOL,7,Charters,33,KINGS,1,3090,NEW YORK CITY,All Students,78,69,0.88,69,0.88,0,0,1,0.01,0,0
2018-19,School,UFT CHARTER SCHOOL (THE),3.31901E+11,UFT CHARTER SCHOOL,7,Charters,33,KINGS,1,3090,NEW YORK CITY,All Students,67,55,0.82,42,0.63,0,0,0,0,3,0.04
2018-19,School,NEW UTRECHT HIGH SCHOOL,3.32E+11,NEW YORK CITY GEOGRAPHIC DISTRICT #20,1,NYC,33,KINGS,1,3090,NEW YORK CITY,All Students,873,678,0.78,379,0.43,262,0.3,6,0.01,80,0.09
2018-19,School,HIGH SCHOOL OF TELECOMMUNICATIONS ARTS AND TECHNOLOGY,3.32E+11,NEW YORK CITY GEOGRAPHIC DISTRICT #20,1,NYC,33,KINGS,1,3090,NEW YORK CITY,All Students,291,265,0.91,165,0.57,83,0.29,0,0,12,0.04
2018-19,School,FORT HAMILTON HIGH SCHOOL,3.32E+11,NEW YORK CITY GEOGRAPHIC DISTRICT #20,1,NYC,33,KINGS,1,3090,NEW YORK CITY,All Students,1111,883,0.79,543,0.49,301,0.27,6,0.01,91,0.08
2018-19,School,FRANKLIN D ROOSEVELT HIGH SCHOOL,3.32E+11,NEW YORK CITY GEOGRAPHIC DISTRICT #20,1,NYC,33,KINGS,1,3090,NEW YORK CITY,All Students,826,566,0.69,423,0.51,93,0.11,7,0.01,101,0.12
2018-19,School,URBAN ASSEMBLY SCHOOL FOR CRIMINAL JUSTICE,3.32E+11,NEW YORK CITY GEOGRAPHIC DISTRICT #20,1,NYC,33,KINGS,1,3090,NEW YORK CITY,All Students,67,65,0.97,27,0.4,35,0.52,0,0,1,0.01
2018-19,School,INTERNATIONAL HIGH SCHOOL AT LAFAYETTE,3.321E+11,NEW YORK CITY GEOGRAPHIC DISTRICT #21,1,NYC,33,KINGS,1,3090,NEW YORK CITY,All Students,92,57,0.62,55,0.6,0,0,0,0,14,0.15
2018-19,School,RACHEL CARSON HIGH SCHOOL OF COASTAL STUDIES,3.321E+11,NEW YORK CITY GEOGRAPHIC DISTRICT #21,1,NYC,33,KINGS,1,3090,NEW YORK CITY,All Students,156,120,0.77,108,0.69,11,0.07,1,0.01,14,0.09
2018-19,School,HIGH SCHOOL OF SPORTS MANAGEMENT,3.321E+11,NEW YORK CITY GEOGRAPHIC DISTRICT #21,1,NYC,33,KINGS,1,3090,NEW YORK CITY,All Students,50,35,0.7,27,0.54,2,0.04,0,0,0,0
2018-19,School,ABRAHAM LINCOLN HIGH SCHOOL,3.321E+11,NEW YORK CITY GEOGRAPHIC DISTRICT #21,1,NYC,33,KINGS,1,3090,NEW YORK CITY,All Students,441,367,0.83,292,0.66,49,0.11,8,0.02,39,0.09
2018-19,School,KINGSBOROUGH EARLY COLLEGE SCHOOL,3.321E+11,NEW YORK CITY GEOGRAPHIC DISTRICT #21,1,NYC,33,KINGS,1,3090,NEW YORK CITY,All Students,85,82,0.96,60,0.71,21,0.25,0,0,0,0
2018-19,School,EDWARD R MURROW HIGH SCHOOL,3.321E+11,NEW YORK CITY GEOGRAPHIC DISTRICT #21,1,NYC,33,KINGS,1,3090,NEW YORK CITY,All Students,888,742,0.84,455,0.51,250,0.28,28,0.03,28,0.03
